Statement Limit,Policy Generation Type,Statement
100,chaining, partner with mental health professionals to provide resources and support for children who have experienced cyberbullying or other negative interactions on social media. 
100,chaining, encourage social media platforms to implement stricter age verification processes to protect children from accessing inappropriate content. 
100,chaining,integrate mental health screenings and support services into social media platforms to identify and assist children at risk of psychological harm due to their online experiences.
100,chaining," establish a national task force composed of experts in child psychology, technology, and law enforcement to continuously assess and address emerging risks to children's safety on social media platforms. "
100,chaining,collaborate with technology companies to develop innovative tools that empower parents to monitor and manage their children's online activities effectively.
100,chaining," incentivize social media companies to prioritize the development of child-friendly features that enhance online safety, such as parental controls and reporting mechanisms for harmful content. "
100,axis, promote digital literacy programs in underserved communities to ensure all children have equal access to online safety education and resources. 
100,axis," implement financial incentives for social media platforms that prioritize children's safety and implement stringent measures to protect minors online, encouraging industry-wide responsibility and accountability. "
100,axis," collaborate with child advocacy groups to advocate for stricter regulations on targeted advertising to children on social media platforms, aiming for equality in protecting vulnerable young users from manipulative marketing tactics. "
100,axis, strengthen data protection regulations on social media platforms to safeguard children's privacy and prevent unauthorized access to their personal information. 
100,axis,"partner with child development experts to create age-appropriate guidelines for social media platforms, ensuring that content and features align with children's cognitive and emotional capabilities."
100,axis," strengthen partnerships with schools and educational institutions to integrate social media literacy and online safety education into the curriculum, empowering parents and guardians with knowledge to guide their children's online behavior. "
100,axis,"collaborate with child psychologists to implement tailored mental health support services within social media platforms, providing immediate assistance to children facing online challenges."
100,axis,"implement a national certification program for social media platforms, ensuring they meet stringent standards for protecting children's privacy and safety online."
100,axis,"work closely with child behavior analysts to develop algorithms that detect and flag patterns of harmful behavior towards children on social media, enhancing platform safety measures."
100,axis, establish a national task force dedicated to monitoring and addressing cyberbullying incidents targeting children on social media platforms. 
100,axis," ensure that social media platforms are designed and equipped with accessibility features to cater to children with disabilities, promoting inclusivity and equal participation in online spaces. "
100,axis," allocate funding for research and development of advanced ai technology to proactively identify and mitigate emerging online risks to children on social media platforms, ensuring continuous improvement in platform safety. "
100,axis, enhance collaboration between social media platforms and child safety organizations to develop real-time monitoring tools that swiftly identify and address instances of online child exploitation and abuse. 
100,axis, introduce mandatory parental controls on devices to limit children's screen time and exposure to potentially harmful content on social media. 
100,axis,implement a rating system for social media platforms that transparently informs parents and guardians about the age-appropriateness and safety features of the content accessible to children.
100,axis," establish a grant program to support the creation of innovative educational content that promotes digital literacy and online safety for children on social media, fostering a culture of responsible digital citizenship from a young age. "
100,axis," partner with cybersecurity experts to develop encryption protocols that safeguard children's personal information on social media platforms, ensuring data privacy and security. "
100,axis,"establish a regulatory framework that mandates regular audits and assessments of social media algorithms to ensure they prioritize child safety and well-being, integrating child-friendly design principles at the core of platform operations."
100,axis,"require social media platforms to regularly publish reports detailing their efforts to combat online harassment, cyberbullying, and inappropriate content targeting children, promoting transparency and accountability in their safety measures."
100,axis, implement regular privacy audits for social media platforms to ensure compliance with data protection laws and identify areas for improvement in safeguarding children's online privacy. 
100,axis," facilitate workshops and support groups for parents and guardians to share experiences, strategies, and concerns related to children's social media usage, fostering a community that empowers adults to navigate the digital landscape alongside their children. "
100,axis, develop gamified educational tools on social media platforms to engage children in learning about online safety practices in an interactive and enjoyable manner. 
100,axis, implement age verification mechanisms on social media platforms to restrict access to age-inappropriate content for children. 
100,axis," encourage social media platforms to implement innovative features that promote positive interactions and safe usage for children, fostering a culture of respect and collaboration online. "
100,axis,Do nothing.
100,axis," establish a peer support network among children on social media platforms to encourage empathy, solidarity, and the reporting of inappropriate behavior, creating a self-regulating online community. "
100,axis," enhance transparency policies on social media platforms regarding the collection, use, and sharing of children's data to build trust and accountability in online interactions. "
100,axis," establish a mandatory certification process for social media influencers targeting children, ensuring they undergo training on promoting positive online behaviors and adhering to child safety guidelines. "
100,axis," implement a national standardized reporting system for social media platforms to disclose how they collect and utilize children's data, enhancing transparency and accountability in data practices. "
100,axis, enhance online safety education programs for children to promote responsible digital citizenship and protect them from online threats. 
100,axis,"establish a public database that tracks and reports on the data collection practices of social media platforms concerning children, increasing transparency around how children's information is used and protected online."
100,axis,"engage child development specialists to design interactive online safety games that simulate real-world scenarios, teaching children how to respond to potential risks effectively."
100,axis, collaborate with social media companies to develop and enforce stricter guidelines on data privacy protection for children's online activities. 
100,axis,establish a mentorship initiative where industry experts provide guidance to social media platforms on implementing inclusive design features for children with diverse needs.
100,axis," establish a mentorship program where older children or teenagers can guide younger peers on safe online practices, fostering a culture of peer support and knowledge-sharing for all children regardless of age. "
100,axis," establish a national awareness campaign highlighting the importance of parental involvement in children's online activities, emphasizing the role of parents and guardians as the first line of defense in ensuring their children's safety on social media platforms. "
100,stakeholder,"establish a tax-supported grant program to incentivize schools and community organizations to organize online safety events and workshops for children and parents, promoting digital well-being and awareness."
100,stakeholder,establish a collaboration platform for child psychologists to share best practices and research on children's online safety within social media environments.
100,stakeholder," advocate for the allocation of resources to equip law enforcement agencies with the necessary tools and technologies to monitor, prevent, and intervene in cases of online harm against children on social media platforms. "
100,stakeholder,"establish a national standard that mandates social media platforms to continuously improve and innovate parental control features, guided by input and feedback from government regulators."
100,stakeholder, collaborate with mental health experts to integrate digital well-being and resilience-building strategies into school curriculums to support children's mental health in the online environment. 
100,stakeholder,enhance public awareness campaigns on the importance and utilization of parental controls and monitoring tools for children's online safety.
100,stakeholder," advocate for the creation of a national helpline staffed by child psychologists to provide immediate support and guidance to children encountering distressing or harmful experiences on social media platforms, promoting empowerment and well-being. "
100,stakeholder," advocate for the development of a ""digital citizenship"" framework in schools to instill responsible and ethical online behavior among children. "
100,stakeholder,implement a national program that provides specialized training for law enforcement officers on utilizing parental control and monitoring tools on social media platforms to protect children from online harm.
100,stakeholder, develop a standardized reporting mechanism for law enforcement agencies to flag and address instances of cyberbullying and online threats targeting children on social media platforms. 
100,stakeholder,develop a mentorship program where child psychologists work directly with schools to integrate online safety education into the curriculum.
100,stakeholder,"introduce tax incentives for social media companies that actively engage in initiatives aimed at enhancing children's digital well-being, encouraging industry support for online safety programs."
100,stakeholder,enhance digital literacy programs for children to promote responsible online behavior and empower them to navigate the digital landscape safely.
100,stakeholder," create a task force comprised of representatives from law enforcement agencies, social media platforms, and child psychologists to develop proactive strategies for protecting children's mental health and well-being in online environments. "
100,stakeholder,"establish a public-private partnership to fund the development of cutting-edge technologies that empower law enforcement agencies to proactively monitor and intervene in cases of online harm against children, ensuring a balance between freedom and safety."
100,stakeholder,"implement a national policy that enforces social media platforms to obtain explicit parental consent before collecting any personal data from children, ensuring the protection of children's privacy rights."
100,stakeholder,collaborate with technology experts to design and implement a user-friendly digital tool that enables law enforcement agencies to efficiently track and address instances of online harm against children on social media platforms.
100,stakeholder,"implement a nationwide digital literacy program for children and parents, focusing on online safety education and awareness campaigns funded through a small tax on social media companies."
100,stakeholder,"implement a national initiative to enhance the accessibility and effectiveness of parental controls and monitoring tools on social media platforms, empowering parents to safeguard their children's online activities."
100,stakeholder,"establish a regulatory framework that mandates social media platforms to regularly report on their efforts to promote children's online safety, including measures taken to combat cyberbullying and harmful content."
100,stakeholder,"establish a collaborative program between privacy advocates and social media companies to design and implement user-friendly parental control features, ensuring transparency and user control over children's online interactions."
100,stakeholder,develop a certification program for social media platforms that meet stringent criteria for promoting children's mental health and well-being through their online services.
100,stakeholder," establish a government-led initiative to fund research projects that investigate the impact of social media on children's mental health, aiming to inform evidence-based policy decisions for improved well-being outcomes. "
100,stakeholder,"enhance collaboration between social media platforms and advertisers to develop user-friendly and accessible parental control features, prioritizing children's online safety."
100,stakeholder,"develop a national initiative to train educators and parents on recognizing and addressing online safety issues, supported by a fund sourced from tax contributions by social media companies."
100,stakeholder,"implement a nation-wide campaign to promote digital literacy and online safety education for children and parents, led by child psychologists."
100,stakeholder,"create a national certification program for educators who complete specialized training in online safety education, recognizing their commitment to promoting digital well-being in the classroom."
100,stakeholder,"develop a partnership program between social media platforms and advertisers to create interactive online safety content targeting children, utilizing the reach and influence of advertisements to promote digital well-being."
100,stakeholder,"establish a national initiative to provide educators with access to specialized resources and workshops focused on promoting digital literacy and online safety education, enabling them to empower children with the knowledge to navigate the digital landscape securely."
100,stakeholder,"implement a national program to enhance digital literacy skills among children, empowering them to make informed decisions and navigate online platforms safely."
100,stakeholder,"partner with social media influencers to promote online safety awareness campaigns targeted at children and parents, leveraging their reach and influence to educate a wider audience."
100,stakeholder,"develop a national initiative that focuses on training law enforcement officers in advanced digital investigation techniques to effectively combat cyberbullying and online threats targeting children, safeguarding their online freedom."
100,stakeholder,"establish a partnership with internet service providers to create a digital well-being support hotline for children, providing immediate assistance and guidance in navigating online challenges."
100,stakeholder,"collaborate with child advocacy groups to create a national hotline for reporting instances of online harm against children, ensuring immediate intervention and support."
100,stakeholder," establish a public-private partnership to develop innovative digital tools that simplify parental control settings across various social media platforms, aiding government efforts in enhancing children's online safety. "
100,stakeholder,"establish a partnership program between schools and social media platforms to create customized online safety education materials for educators, ensuring they have the necessary resources to teach children about responsible online behavior."
100,stakeholder,Do nothing.
100,stakeholder,"implement a national policy framework that mandates regular audits and assessments of social media platforms' compliance with child safety standards, ensuring accountability and continuous improvement."
100,stakeholder," develop a national initiative that focuses on training law enforcement officers in advanced digital investigation techniques to effectively combat online threats targeting children, ensuring their empowerment and protection in the digital realm. "
100,stakeholder,"collaborate with child development experts to design and implement educational campaigns aimed at empowering children to recognize and respond to online risks, promoting resilience and positive digital interactions."
100,stakeholder,implement a national initiative that emphasizes teaching children critical thinking skills to evaluate online information and make informed decisions while navigating social media platforms.
100,stakeholder,"introduce tax incentives for social media companies that actively engage in initiatives to enhance children's digital well-being, such as funding educational programs or developing innovative safety features."
100,stakeholder,establish a mandatory certification program for social media influencers who commit to promoting positive online behaviors and safety practices for children and parents.
100,stakeholder,collaborate with child psychologists to develop interactive online safety games that empower children to navigate digital environments securely.
100,stakeholder, advocate for the development of a child-friendly reporting system on social media platforms to empower children to flag and report harmful content easily and efficiently. 
100,stakeholder,establish a national helpline staffed by child psychologists to provide immediate support and guidance to children facing distressing or harmful experiences on social media platforms.
100,stakeholder, collaborate with schools to integrate digital literacy and online safety education into the curriculum from an early age. 
100,stakeholder, implement a national program that enables law enforcement agencies to collaborate with social media platforms in real-time to address online safety concerns for children. 
100,stakeholder,establish a national helpline dedicated to providing guidance and support to parents on effectively implementing and managing parental controls on social media platforms.
100,stakeholder,"establish a public-private partnership to develop and distribute educational materials on online safety for children and parents, funded by contributions from internet service providers."
100,stakeholder,"collaborate with technology companies to develop innovative age-appropriate online safety tools and resources for children, empowering them to navigate digital environments securely."
100,stakeholder,establish a national initiative to provide training and resources for internet service providers on effectively supporting parents in utilizing parental control features across various social media platforms.
100,stakeholder, encourage social media platforms to implement stricter age verification measures to protect children from accessing inappropriate content. 
100,stakeholder,establish a tax incentive scheme for advertisers who support and sponsor online safety educational programs and initiatives aimed at children and parents on social media platforms.
100,stakeholder,"establish a comprehensive training program for law enforcement agencies to enhance their capabilities in addressing online safety incidents involving children, including cyberbullying and digital harassment."
100,stakeholder,develop a national initiative to provide law enforcement agencies with access to training resources and workshops on utilizing parental controls effectively to combat online threats against children.
100,stakeholder,"implement a national program that encourages social media platforms to collaborate with advertisers in promoting online safety initiatives for children, fostering a balance between children's freedom online and responsible advertising practices."
100,stakeholder,"advocate for the inclusion of digital citizenship and online safety topics in national educational standards, ensuring that schools prioritize these crucial skills alongside traditional subjects."
100,stakeholder,"establish a national standard for social media platforms to provide transparent and accessible reporting on the effectiveness of their child safety measures, promoting accountability and continuous improvement."
100,stakeholder,"enhance collaboration between social media platforms and law enforcement agencies to develop real-time reporting mechanisms for online safety incidents involving children, improving response times and effectiveness."
100,stakeholder,"implement a national program that offers mental health and well-being training sessions for internet service providers, focusing on identifying and addressing online safety concerns affecting children."
100,stakeholder,"create a tax-funded program to provide free access to online safety workshops and resources for schools, parents, and children, aimed at fostering a secure online environment."
100,stakeholder," collaborate with social media platforms to establish a dedicated forum where child psychologists can contribute expertise and guidance on enhancing children's online safety measures, ensuring their voices are integrated into platform development. "
100,stakeholder,"collaborate with schools to implement a mandatory online safety curriculum for students at all grade levels, integrating lessons on cyberbullying prevention and responsible online behavior."
100,stakeholder,collaborate with internet service providers to develop and implement a standardized system for reporting and addressing instances of online harm against children on social media platforms.
100,stakeholder,"implement a public-private initiative to fund the development of interactive online safety resources tailored to different age groups, enhancing engagement and effectiveness of educational efforts."
100,stakeholder, implement a national program that promotes positive online behavior and interactions among children through interactive educational campaigns and resources. 
100,stakeholder,enhance collaboration between internet service providers and social media platforms to streamline the implementation and accessibility of parental control and monitoring tools for children's online safety.
100,stakeholder,"implement a nationwide program that enhances collaboration between law enforcement agencies and social media platforms to develop real-time protocols for addressing online safety concerns for children, ensuring a secure digital environment."
100,stakeholder," implement a nationwide public awareness campaign to educate children on recognizing and responding to online dangers, prioritizing mental health and well-being resources for young users. "
100,stakeholder," create a digital well-being fund supported by a small tax on social media companies, with the funds dedicated to providing mental health resources and counseling services for young users affected by online harm or cyberbullying. "
100,stakeholder,implement a nationwide initiative to develop educational campaigns that empower children to critically evaluate online information and make informed decisions while navigating social media platforms.
100,stakeholder, incentivize social media companies to invest in advanced ai technology to detect and remove harmful content targeting children. 
100,stakeholder,"partner with technology companies to develop innovative tools that allow children to manage their online privacy settings easily and effectively, empowering them to control their digital footprint."
100,stakeholder," establish a national task force comprised of experts in child psychology, cybersecurity, and social media to develop comprehensive guidelines for children's online safety. "
100,stakeholder," develop a national framework that mandates social media platforms to provide accessible mental health resources and support services for young users, ensuring a safe online environment conducive to positive well-being. "
100,stakeholder,advocate for the integration of law enforcement representatives in the development and testing of new parental control tools on social media platforms to ensure they meet the needs and standards of child safety enforcement.
100,stakeholder,implement a national program that provides free access to mental health counseling services for young social media users through a secure and confidential online platform.
100,stakeholder,"implement a national initiative to create interactive online safety games and activities for children, engaging them in learning about digital well-being and safe online practices."
100,stakeholder, foster partnerships between social media platforms and mental health organizations to provide resources and support for children facing cyberbullying or online harassment. 
100,stakeholder,establish a collaborative initiative between government regulators and social media platforms to develop and implement real-time strategies that protect children online while respecting their digital rights.
100,stakeholder," establish a specialized training program for law enforcement officers to enhance their skills in investigating and responding to online safety incidents involving children, strengthening government efforts to empower children in navigating online risks. "
100,stakeholder,"collaborate with social media platforms to develop innovative tools that empower children to navigate the online landscape safely, respecting their autonomy and freedom."
