Statement Limit,Policy Generation Type,Statement
20,base,Do nothing.
20,base,"enhance digital literacy programs in schools to educate children on online safety, privacy protection, and responsible social media usage"
20,base,"encourage the development of innovative technology solutions that promote a safer online environment for children, such as ai-powered content filtering and moderation systems"
20,base,collaborate with social media companies to develop and enforce stricter guidelines on cyberbullying prevention and reporting mechanisms
20,base,implement mandatory age verification mechanisms on social media platforms to restrict access to age-inappropriate content for children
20,base,introduce regulations requiring social media platforms to provide transparent and accessible tools for parents to monitor and control their children's online activities
20,base,"establish a national task force dedicated to monitoring and addressing emerging online risks and threats to children, with a focus on proactive intervention and support"
20,chaining,"collaborate with social media companies to develop innovative tools and features that promote online safety for children, such as parental controls and time limits."
20,chaining,"introduce digital literacy programs in schools to educate children on safe and responsible social media usage, including recognizing and reporting online threats."
20,chaining,Do nothing.
20,chaining," develop and implement a comprehensive curriculum in schools that includes education on digital citizenship, online ethics, and the potential risks associated with social media use. "
20,chaining,establish a national task force dedicated to monitoring and addressing emerging risks and trends related to children's safety on social media platforms.
20,chaining, create a public awareness campaign to educate parents and caregivers about monitoring and guiding children's online activities to ensure their safety and well-being. 
20,chaining,implement mandatory age verification measures on social media platforms to prevent children under the age of 13 from creating accounts.
20,chaining, foster partnerships between social media platforms and mental health professionals to provide resources and support for children experiencing cyberbullying or other online safety issues. 
20,chaining,enforce strict guidelines for online content targeting children to ensure age-appropriate materials and protect them from harmful or inappropriate content.
20,axis,"implement financial incentives for social media platforms that prioritize and invest in advanced child safety features and technologies, encouraging industry innovation and compliance."
20,axis, foster collaboration between technology companies and child psychologists to create innovative tools that safeguard children from online risks. 
20,axis," collaborate with schools and educational institutions to integrate comprehensive online safety curriculum into their programs, fostering equality in knowledge and awareness among all children. "
20,axis," establish a national task force dedicated to monitoring and enforcing compliance with child safety regulations on social media platforms, ensuring swift and appropriate responses to reported incidents."
20,axis, empower parents with resources and information to effectively monitor and manage their children's online activities and interactions. 
20,axis, introduce age verification mechanisms on social media platforms to restrict access to age-inappropriate content and protect children from exposure to harmful material.
20,axis," establish a standardized reporting system for children to easily flag and report inappropriate or harmful content encountered on social media, ensuring timely intervention by platform moderators. "
20,axis, implement mandatory online safety training and certification programs for social media platform moderators to ensure they are equipped to effectively identify and address child safety issues.
20,axis, encourage the development of innovative ai-driven tools that proactively detect and prevent harmful content targeting children on social media platforms. 
20,axis," implement regulations that require social media platforms to disclose how they collect, store, and use children's data to ensure transparency and privacy protection. "
20,axis," collaborate with child advocacy groups and social media platforms to create a unified set of industry standards for child safety online, promoting a consistent approach across platforms. "
20,axis,Do nothing.
20,axis,establish a dedicated fund within the national budget to support research and development of cutting-edge tools and resources aimed at enhancing children's online safety across social media platforms.
20,axis,"enhance transparency measures on social media platforms regarding the algorithms used to recommend content to children, ensuring parents and guardians have visibility into the information their children are exposed to."
20,axis, enhance online safety education programs for children to promote responsible and secure use of social media platforms. 
20,axis, encourage social media platforms to develop language-specific safety features and content moderation tools to address the diverse linguistic needs of children from various cultural backgrounds. 
20,axis,"require social media platforms to provide regular reports detailing the number and nature of content moderation actions taken to protect children from harmful online content, promoting accountability and transparency."
20,axis," enforce strict penalties on social media platforms that fail to comply with child safety regulations, prioritizing equality in protecting all children from online harm. "
20,axis, promote diversity and inclusion in online safety education programs to cater to the cultural sensitivities and backgrounds of all children. 
20,axis, promote digital literacy programs for children from underserved communities to ensure equal access to online safety education and resources. 
20,axis, develop age-appropriate guidelines for social media companies to prioritize child safety features and content moderation. 
20,stakeholder, promote the development of innovative technologies that monitor and limit screen time for children using social media platforms. 
20,stakeholder, implement stricter regulations on data collection practices by social media companies to protect children's privacy and prevent targeted advertising. 
20,stakeholder, implement a nationwide campaign led by child psychologists and mental health experts to raise awareness among parents and educators about the importance of monitoring children's social media activities for early signs of mental health concerns. 
20,stakeholder, foster collaboration between social media platforms and child advocacy organizations to develop and enforce age-appropriate content guidelines. 
20,stakeholder,collaborate with legal advocates for children's rights to create legislation that holds social media companies accountable for safeguarding children's online experiences and upholding their rights to privacy and safety.
20,stakeholder,"implement a nationwide program that offers free mental health counseling and support services for parents of children affected by harmful interactions on social media platforms, funded through taxes to ease the burden on taxpayers."
20,stakeholder," collaborate with mental health professionals to develop standardized guidelines for social media companies on handling reports of child safety concerns, ensuring swift and appropriate responses to protect children online. "
20,stakeholder,"develop a mobile app that offers parents real-time monitoring tools and alerts to help them track their children's online activities on social media platforms, with integrated access to mental health resources for guidance."
20,stakeholder, create a national awareness campaign to educate parents and caregivers on the potential risks of social media and provide resources for promoting safe online behaviors. 
20,stakeholder," establish a research initiative in partnership with mental health experts to study the long-term effects of social media use on children's mental health and well-being, guiding evidence-based policy decisions. "
20,stakeholder, implement a national program that provides free mental health screenings and counseling services for children who have experienced cyberbullying or other harmful online interactions. 
20,stakeholder,"establish a collaborative initiative between social media companies and mental health professionals to create interactive online resources that educate parents on recognizing and addressing signs of mental health issues in children resulting from social media use, with costs covered by taxpayers."
20,stakeholder," establish a task force composed of child psychologists, mental health professionals, and social media platform representatives to regularly review and update online safety guidelines for children, ensuring alignment with the latest research on mental health impacts. "
20,stakeholder,Do nothing.
20,stakeholder, enhance online safety education in schools to empower children with the knowledge and skills to navigate social media responsibly. 
20,stakeholder,implement a national policy mandating social media platforms to provide easily accessible mental health resources and support for children exposed to harmful content or interactions.
20,stakeholder,establish a national helpline for parents to access immediate support and guidance from mental health professionals regarding their children's social media usage and online safety concerns.
20,stakeholder," implement a nationwide initiative to provide free parenting workshops led by mental health professionals, focusing on guiding parents in promoting healthy social media habits for their children. "
20,stakeholder,"introduce a certification program for social media platforms that demonstrate proactive measures in prioritizing children's safety, including collaborating with mental health professionals to provide support resources for parents."
20,stakeholder," create a public-private partnership program that offers subsidies for families to access parental control tools and mental health support services, enhancing children's safety and mental well-being online. "
20,problem,introduce mandatory parental controls on devices to limit children's screen time and protect them from harmful online content
20,problem," implement a data privacy and security framework specifically tailored for children's personal information on social media platforms, ensuring compliance from technology companies and social media platforms. "
20,problem, implement a nationwide campaign in collaboration with technology companies and social media platforms to promote mental health awareness and responsible internet usage among children. 
20,problem,"establish a research fund in partnership with technology companies to support studies investigating the impact of social media on children's mental health, aiming to inform evidence-based policies and innovative solutions for enhancing online safety and well-being."
20,problem," establish a collaborative initiative between technology companies, social media platforms, and mental health professionals to create online support groups for children affected by negative experiences on social media. "
20,problem," establish a specialized task force consisting of experts in data privacy, child protection, and technology to develop and oversee the implementation of regulations safeguarding children's personal information on social media platforms. "
20,problem,"implement a proactive content moderation system on social media platforms to swiftly identify and remove harmful or abusive content targeting children, while providing immediate access to mental health support resources."
20,problem,collaborate with social media companies to develop ai tools that can detect and prevent cyberbullying targeting children
20,problem,"introduce a rating system for technology companies and social media platforms based on their commitment to prioritizing children's mental health and safety, incentivizing proactive measures and resource availability through public recognition and support."
20,problem, implement a certification program for technology companies and social media platforms that demonstrate effective measures in combating cyberbullying and providing mental health support resources for children. 
20,problem, establish a reward system for technology companies and social media platforms that actively engage in promoting mental health resources and education for children on their platforms. 
20,problem,require technology companies and social media platforms to offer real-time mental health chat support services for children encountering distressing content or online bullying.
20,problem," develop a standardized reporting system on social media platforms for children to easily report inappropriate content or behavior, with built-in links to mental health support resources. "
20,problem," implement a ""safe social media certification"" program for technology companies and social media platforms, ensuring they meet specific criteria related to child safety, including incorporating mental health support resources and actively combating online grooming and exploitation of children by predators. "
20,problem,establish a partnership between mental health professionals and technology companies to develop virtual reality experiences that promote relaxation and stress management for children using social media.
20,problem,Do nothing.
20,problem, require technology companies and social media platforms to provide easily accessible mental health support resources within their platforms for children encountering cyberbullying or harmful content. 
20,problem,enhance digital literacy programs in schools to educate children on safe and responsible social media usage
20,problem,"develop a feature on social media platforms that allows children to set personalized boundaries for their online interactions, with options to limit exposure to triggering content and receive notifications about available mental health resources based on their preferences."
20,problem,implement a gamified mental health education program within social media platforms to engage children in learning about emotional well-being and coping strategies.
20,problem,"establish a comprehensive online safety curriculum in collaboration with technology companies and social media platforms to educate children on recognizing and responding to online risks, including cyberbullying and exploitation, while integrating mental health awareness and coping strategies."
20,problem," create a task force comprised of representatives from technology companies, social media platforms, child protection agencies, and mental health experts to develop and enforce industry-wide guidelines for preventing online grooming and exploitation of children. "
20,problem,establish a national standard for online privacy protection to safeguard children's personal information on social media
20,problem,implement age verification mechanisms on social media platforms to restrict underage users from accessing inappropriate content
50,base, implement age verification mechanisms on social media platforms to restrict access to age-inappropriate content for children. 
50,base, enforce stricter regulations on targeted advertising to children on social media platforms to mitigate potential harm and exploitation. 
50,base,Do nothing.
50,base, enhance online safety education in schools to empower children with the knowledge and skills to navigate social media responsibly. 
50,base, promote digital well-being initiatives that encourage a healthy balance between online and offline activities for children using social media. 
50,base, establish a national framework for reporting and addressing cyberbullying incidents on social media platforms to protect children from online harassment. 
50,base, foster collaboration between social media companies and child safety organizations to develop innovative tools for parental control and monitoring of children's online activities. 
50,base, encourage the development of child-friendly privacy settings on social media platforms to safeguard children's personal information and online interactions. 
50,chaining," establish a rating system for social media platforms based on their safety features for children, incentivizing platforms to prioritize safety in their design and functionality. "
50,chaining, enforce more stringent regulations on data privacy protection for children on social media platforms to prevent unauthorized data collection and targeted advertising. 
50,chaining, foster partnerships between social media companies and mental health professionals to provide resources and support for children facing cyberbullying or online harassment. 
50,chaining,Do nothing.
50,chaining," introduce a ""safe social media"" certification program for platforms that meet stringent safety standards, promoting transparency and accountability in protecting children online. "
50,chaining, enhance online safety education in schools to empower children with the knowledge and skills to navigate social media responsibly. 
50,chaining," create a national hotline for children to report online safety concerns, providing immediate support and guidance in collaboration with relevant authorities. "
50,chaining, collaborate with social media platforms to implement stricter age verification mechanisms to prevent underage users from accessing inappropriate content. 
50,chaining, implement mandatory periodic privacy audits for social media platforms to ensure compliance with child data protection laws and regulations. 
50,chaining," develop a national ""digital citizenship"" curriculum to promote ethical online behavior and digital wellness from an early age. "
50,chaining," establish a task force comprising child psychologists, educators, and tech experts to continuously assess and address emerging risks to children's safety on social media platforms. "
50,chaining, encourage social media platforms to develop innovative tools using artificial intelligence to detect and prevent grooming behaviors targeting children. 
50,axis," implement a national program that provides comprehensive online safety training for educators, parents, and children to promote a culture of digital citizenship and responsible online behavior. "
50,axis,integrate child psychology principles into the design and evaluation of online safety education programs on social media platforms to ensure they are effective and tailored to children's cognitive and emotional development.
50,axis, foster collaboration between social media platforms and child safety organizations to develop effective reporting and response mechanisms for online bullying and harassment. 
50,axis,"implement a national program that provides subsidies to schools for the purchase of digital safety tools and resources, enhancing children's online protection within educational settings."
50,axis,partner with community organizations and youth groups to develop mentorship programs that empower children to become digital ambassadors for online safety and positive social media interactions.
50,axis,collaborate with mental health professionals to integrate mental well-being assessments into social media platforms aimed at identifying and supporting children at risk of mental health issues due to their online experiences. 
50,axis,establish a grant program that allocates funding from the national budget to support innovative research projects focused on developing advanced technologies for identifying and preventing online risks to children on social media platforms.
50,axis, encourage parental involvement in monitoring and guiding children's online activities by providing resources and guidance on digital parenting strategies. 
50,axis,"implement a national initiative to develop and deploy advanced ai algorithms for real-time monitoring and filtering of age-inappropriate content on social media platforms, enhancing children's online safety."
50,axis, enhance online safety education for children through interactive and age-appropriate resources on social media platforms. 
50,axis,"enforce transparency in social media platform policies regarding data collection from children, requiring explicit consent and clear explanations of how the data will be used to protect their privacy."
50,axis, implement stringent age verification measures to restrict children's access to age-inappropriate content on social media. 
50,axis,establish a national campaign to raise awareness among parents about the potential risks of social media for children and provide guidance on fostering a safe online environment at home.
50,axis,require social media platforms to provide regular reports on the types and frequency of privacy breaches related to children's data to promote transparency and encourage better data protection measures.
50,axis,establish a youth advisory board within social media companies to ensure that children's perspectives and safety concerns are integrated into platform design and policy decisions.
50,axis, introduce gamified safety modules on social media platforms to engage children in learning about online safety practices through interactive and entertaining experiences. 
50,axis,"introduce a ""safety by design"" policy that mandates social media platforms to transparently disclose the safety features embedded in their products and services to protect children online."
50,axis,"encourage social media platforms to publish annual transparency reports detailing their efforts to safeguard children's online experiences, including measures taken to combat cyberbullying and harmful content."
50,axis," implement a national campaign to educate children on the importance of safeguarding their personal information online, promoting a culture of privacy awareness from a young age."
50,axis,establish a public database or registry of online safety incidents involving children on social media platforms to increase transparency and accountability in addressing such issues.
50,axis,"partner with child advocacy groups and technology experts to create a standardized framework for evaluating the effectiveness of age-appropriate content filters on social media platforms, ensuring consistent and reliable protection for children."
50,axis,Do nothing.
50,axis,develop an independent oversight body tasked with monitoring social media platforms' compliance with child safety regulations and promoting transparency in their operations.
50,axis,implement regular audits and evaluations of social media platforms' safety features and algorithms to ensure transparency in how they prioritize children's online safety.
50,axis,implement parental control features on social media platforms to enable parents to set restrictions and filters based on their children's age and maturity level.
50,axis,implement a system that recognizes and rewards social media platforms that actively engage in promoting inclusivity and constructive dialogue among children from different socio-economic backgrounds.
50,axis," develop guidelines for social media platforms to clearly outline how children's data is used for targeted advertising, enhancing transparency and privacy protection for young users."
50,axis,"introduce a national initiative to promote cross-cultural understanding and inclusivity on social media platforms, emphasizing the importance of respecting diverse perspectives and backgrounds."
50,axis,partner with schools and community centers to host workshops and events that promote healthy online behaviors and teach children how to recognize and respond to online risks effectively.
50,axis," partner with child psychologists and educators to design gamified tools that help children develop critical thinking skills to evaluate information on social media, empowering them to make informed decisions while navigating the online world. "
50,axis,enhance transparency in targeted advertising to children on social media platforms by ensuring clear disclosure of data collection practices and the rationale behind ad targeting.
50,axis,collaborate with tech companies to create innovative parental control tools that allow parents to monitor and manage their children's social media usage while respecting children's digital freedom.
50,axis, promote digital literacy programs in schools to empower children with the skills to navigate social media responsibly and critically evaluate online information. 
50,axis,introduce mandatory online safety education modules in school curricula to equip children with the knowledge and skills to protect themselves from online risks while promoting digital citizenship.
50,axis,"develop a national certification program for social media platforms that meet stringent safety and privacy standards for children, incentivizing platforms to prioritize child safety."
50,axis," establish a rewards system within social media platforms that incentivizes children to complete online safety quizzes, challenges, or courses, promoting continuous learning and awareness of safe digital practices. "
50,axis,enhance transparency on social media platforms by requiring clear labeling of sponsored content aimed at children to distinguish it from organic posts.
50,stakeholder, enhance online safety education for children by promoting interactive and engaging platforms that teach digital literacy and responsible social media usage. 
