Statement Limit,Policy Generation Type,Statement
100,stakeholder," establish a specialized training program for law enforcement officers to enhance their skills in investigating and responding to online safety incidents involving children, including cyberbullying and digital harassment. "
100,stakeholder," implement a national awareness campaign to educate parents and caregivers on how to monitor and support children's online activities, emphasizing the importance of open communication and setting digital boundaries. "
100,stakeholder,"collaborate with tech experts to develop a user-friendly mobile app that centralizes parental control settings across various social media platforms, making it easier for parents to monitor their children's online activities."
100,stakeholder,"establish a public-private partnership to create interactive online safety resources for children and parents, utilizing funds generated from tax incentives offered to social media companies prioritizing children's digital well-being."
100,stakeholder,implement a nation-wide initiative that requires social media platforms to allocate a percentage of their advertising revenue towards funding education and awareness campaigns on online safety for children and parents.
100,stakeholder,implement a nationwide program offering free workshops and training sessions for parents on how to navigate and utilize parental control features effectively on social media platforms.
100,stakeholder,"implement a national program to develop interactive online safety games and activities for children, empowering them to make informed decisions and navigate digital environments securely."
100,stakeholder,enhance government regulations to ensure social media platforms provide easily accessible and user-friendly parental control and monitoring tools for children's online safety.
100,stakeholder,"advocate for the development of user-friendly tools that allow children to manage their online privacy settings effectively, promoting autonomy and control over their digital footprint."
100,stakeholder," collaborate with social media platforms to establish a standardized system for monitoring and addressing instances of harmful content targeting children, with a focus on enhancing mental health support services. "
100,stakeholder," establish a public-private partnership to develop innovative age-appropriate online safety tools and resources for children, fostering a safer online environment. "
100,stakeholder,"develop a mobile app that provides real-time alerts and tips on online safety for children, empowering them to make informed decisions while using social media platforms."
100,stakeholder,"establish a public-private partnership to fund research projects that investigate the intersection of children's online safety and freedom of speech, aiming to inform policy decisions that balance safety and individual rights."
100,stakeholder," advocate for the development of a ""digital citizenship"" framework that promotes responsible and ethical behavior online among children. "
100,stakeholder, enhance government regulations to ensure social media platforms prioritize children's online safety over profit-driven interests. 
100,stakeholder, implement a national program that mandates social media platforms to provide child psychologists with access to real-time data and insights on children's online behavior to enhance research and intervention strategies. 
100,stakeholder,implement a national program that integrates digital well-being and online safety education into the core curriculum for educators to facilitate teaching children about responsible online behavior and mental health awareness.
100,problem,"establish a national initiative to provide hands-on training workshops for children on social media literacy and digital citizenship, empowering them to navigate online platforms safely while exercising their freedom of expression."
100,problem," establish a task force within government agencies dedicated to overseeing and regulating social media platforms to ensure compliance with child safety guidelines, enhancing children's freedom from online threats."
100,problem,"implement a government-funded support system providing counseling, legal aid, and rehabilitation services for children who have been victims of online exploitation or abuse, ensuring their freedom from further harm and empowering them to seek justice."
100,problem,"implement a national program that provides teachers and school administrators with advanced tools and resources to effectively monitor and enforce restrictions on inappropriate content and activities for children on social media, enhancing children's freedom online."
100,problem,establish a government-led task force focused on setting and enforcing stringent regulations on social media platforms to protect children's freedom from manipulative marketing practices.
100,problem,"establish a government-led initiative to create a certification system for social media platforms that prioritize children's mental health and well-being, promoting platforms that enhance children's online experience while respecting their freedom."
100,problem," implement a national reporting system on social media platforms for users to easily report instances of cyberbullying or harassment of children, ensuring prompt action by platform moderators. "
100,problem,"establish a government-led initiative to provide ongoing training and resources for social media companies on best practices for safeguarding children's data privacy, empowering them to prioritize children's freedom while operating their platforms."
100,problem,"develop and implement a national policy framework that outlines clear guidelines for social media platforms to safeguard children's privacy and personal information online, ensuring their freedom from unauthorized data collection and exploitation, with a focus on enabling law enforcement agencies to enforce these regulations effectively."
100,problem,"establish a collaborative initiative between tech industry professionals, child safety experts, and government agencies to innovate cutting-edge technologies that proactively identify and eliminate online threats to children's safety, preserving their freedom online."
100,problem,"implement a nationwide initiative that integrates social media literacy and digital citizenship education into the core curriculum of schools, ensuring all children have access to comprehensive online safety training."
100,problem,establish a collaborative initiative between social media platforms and child safety experts to create a standardized age verification system that enhances child safety and protects their online experience while respecting their freedom to explore safely.
100,problem,"establish a collaborative initiative between social media platforms and child safety experts to develop advanced algorithms that proactively identify and eliminate harmful or predatory content targeting children, safeguarding their freedom from online threats."
100,problem,"implement a national program that offers specialized training for teachers and school administrators on identifying and addressing online exploitation or abuse of children, enabling them to protect children's freedom and well-being in the digital space."
100,problem,"implement a national policy mandating all social media platforms to implement robust age verification processes to protect children's online experiences, ensuring their freedom from exposure to inappropriate content."
100,problem," implement a national helpline dedicated to providing immediate support and guidance for children facing online exploitation or abuse, ensuring their freedom from harm and offering a resource for prompt assistance. "
100,problem,"establish a public-private partnership initiative to develop innovative tools that allow parents to monitor and guide their children's online activities effectively, empowering parents to balance freedom with safety in their children's digital experiences."
100,problem,"introduce legislation that mandates social media platforms to allocate a percentage of their annual revenue towards funding educational campaigns promoting online safety and digital citizenship for children, ensuring a safer online environment while respecting taxpayers' interests."
100,problem, establish a task force within the government focused on monitoring and regulating social media platforms to ensure they comply with child safety guidelines and swiftly address any violations. 
100,problem," implement a national awareness campaign that educates children, parents, and educators on recognizing and reporting online threats, promoting a culture of digital literacy and responsibility while safeguarding freedom of speech. "
100,problem,"implement a national guideline framework for teachers and school administrators to effectively protect children's privacy and personal information online, ensuring their freedom from potential data breaches or exploitation."
100,problem,"establish a collaborative initiative between government agencies, tech experts, and child safety advocates to create standardized protocols for protecting children's online privacy, empowering law enforcement agencies to monitor and address violations effectively while upholding children's freedom in the digital space."
100,problem,enhance children's freedom from exposure to harmful online content through the development of advanced artificial intelligence tools for real-time monitoring and removal on social media platforms.
100,problem,implement a national program that encourages social media companies to collaborate with child psychologists and educators to develop child-friendly features and content filters that protect children's freedom online.
100,problem,enhance children's freedom online by implementing a national program that promotes positive digital interactions and fosters empathy and respect on social media platforms.
100,problem," implement a national task force dedicated to continuously monitoring and updating social media platform safety features to prevent cyberbullying and harassment, ensuring children's freedom from online threats. "
100,problem," implement a national program that empowers government agencies with the tools and resources to effectively monitor and enforce child safety measures on social media platforms, safeguarding children's freedom online."
100,problem," create a tax incentive program for social media companies that invest in research and development to enhance child safety measures on their platforms, encouraging innovation in safeguarding children's online experiences. "
100,problem,implement a national task force dedicated to developing and enforcing strict regulations on social media platforms to protect children's freedom from exposure to harmful and inappropriate content.
100,problem, implement a standardized age verification system on all social media platforms to enhance child safety and protect their online experience. 
100,problem," implement regulations that restrict the use of targeted advertising to children on social media platforms, safeguarding their privacy and well-being while upholding their freedom from manipulative marketing practices. "
100,problem,"implement a national program that partners with social media companies to develop innovative ai-powered tools for real-time monitoring and removal of inappropriate content targeting children, ensuring their freedom from harmful online experiences."
100,problem,"implement a national initiative that encourages the development of innovative artificial intelligence tools to detect and remove harmful content targeting children on social media platforms, ensuring a safer online environment and preserving children's freedom of expression, with a focus on involving tech industry professionals and child safety experts."
100,problem," enforce regulations that restrict the use of targeted advertising to children on social media platforms, safeguarding their privacy and well-being while upholding their freedom from manipulative marketing practices. "
100,problem," implement a nationwide campaign that educates children, parents, and educators on the importance of digital privacy and empowers them to protect children's data on social media platforms, enhancing freedom through informed decision-making. "
100,problem," collaborate with social media platforms to develop educational campaigns that raise awareness among children about the importance of protecting their personal information online, enhancing their freedom through informed decision-making and respect for privacy. "
100,problem,"implement a national curriculum standard that integrates social media literacy and digital citizenship education into all schools, empowering teachers and school administrators to educate children on responsible online behavior while promoting their freedom to navigate the digital world safely."
100,problem,Do nothing.
100,problem,"enforce regulations that require social media platforms to provide comprehensive training for children on recognizing and reporting online threats, empowering them to protect their freedom of speech while ensuring a safe online environment."
100,problem," implement regulations that prohibit social media platforms from using personalized data to target advertisements to children, ensuring their freedom from manipulative marketing practices."
100,problem,"implement a government-sponsored initiative to create a peer support network among teachers and school administrators to share best practices in monitoring and addressing online safety concerns, fostering a culture of collaboration and empowerment."
100,problem,"implement a national certification program for social media platforms that prioritize children's safety and freedom online, ensuring compliance through transparent standards and accountability measures."
100,problem," implement a national program that provides parents with user-friendly tools to monitor and control their children's social media activity, promoting a balance between freedom and safety while empowering taxpayers with resources. "
100,problem,"create a tax incentive scheme for companies that develop innovative educational technology solutions to enhance children's understanding of digital privacy and safety on social media platforms, encouraging private sector involvement in addressing the education gap."
100,problem,"develop and implement a national framework that requires social media platforms to obtain explicit parental consent before collecting or using children's personal information, ensuring their privacy and freedom online."
100,problem,"establish a national task force dedicated to investigating and prosecuting individuals and entities involved in online exploitation or abuse of children, strengthening the government's role in protecting children's freedom from online threats."
100,problem,"implement a reward system for social media platforms that consistently demonstrate effective measures in safeguarding children's online safety, incentivizing proactive efforts and fostering a culture of accountability."
100,problem,empower parents and caregivers with resources and tools to monitor and manage their children's online activities effectively.
100,problem,"establish a national accreditation program for schools that effectively integrate social media safety education into their curriculum, empowering educators to promote children's freedom in navigating online platforms responsibly."
100,problem,enhance children's online safety by implementing a national program that provides comprehensive training for government agencies on monitoring and regulating social media platforms to protect children's freedom from online exploitation or abuse.
100,problem,"introduce legislation that mandates social media platforms to regularly audit and report on their data collection practices concerning children, promoting transparency and empowering taxpayers to hold companies accountable for safeguarding children's privacy and freedom online."
100,problem,enhance children's freedom online by developing a national program that promotes positive digital interactions and fosters empathy and respect on social media platforms.
100,problem,"establish a national task force specifically focused on monitoring and ensuring social media platforms' adherence to stringent privacy protection measures for children, promoting a secure online environment while upholding children's freedom."
100,problem," create incentives for social media platforms to adopt and adhere to stringent age verification processes, ensuring compliance through government oversight and penalties for non-compliance. "
100,problem,implement a comprehensive online safety curriculum in schools to educate children on responsible social media usage and digital citizenship.
100,problem,"establish a government-sponsored program that provides tax incentives to social media companies that prioritize children's data protection and online privacy, encouraging compliance and accountability while respecting taxpayers' interests."
100,problem,"promote positive online behavior through campaigns that emphasize kindness, respect, and empathy in digital interactions."
100,problem," create a digital mentorship program where tech-savvy youth volunteers guide and educate their peers on safe social media practices, promoting a culture of peer-to-peer learning and empowering children to exercise their online freedom wisely."
100,problem,"implement a national program that requires social media companies to provide easily accessible and comprehensive support services for children who have been victims of online exploitation or abuse, ensuring their freedom from further harm and empowering them to seek help."
100,problem,"introduce a policy that incentivizes social media companies to invest in the creation of child-friendly features and content filters that enhance children's online experience, promoting their freedom of expression while prioritizing safety."
100,problem,"implement a system that requires social media companies to provide clear and easily accessible opt-out options for online targeted advertising to children, ensuring their freedom from intrusive marketing practices."
100,problem,"introduce regulations that restrict the use of targeted advertising to children on social media platforms, safeguarding their privacy and well-being while upholding their freedom from manipulative marketing practices."
100,problem,"introduce regulations that require social media companies to collaborate with child psychologists and educators to develop educational campaigns promoting positive online behavior, fostering a culture of empathy and respect while upholding children's freedom of expression."
100,problem," establish a government-led certification program for social media platforms that demonstrate robust measures to safeguard children's online privacy, promoting transparency and accountability in the digital space. "
100,problem,"establish a public-private partnership initiative to develop cutting-edge technologies that proactively identify and remove harmful content targeted at children on social media, safeguarding their freedom from online threats."
100,problem,enforce stricter age verification measures on social media platforms to prevent underage users from accessing inappropriate content.
100,problem, enhance children's freedom from cyberbullying and harassment on social media through the development and implementation of advanced ai-powered tools for real-time monitoring and removal of harmful content targeting children. 
100,problem," establish a government-funded initiative to train teachers and educators on best practices for teaching children about online safety, empowering them to instill crucial digital literacy skills while respecting children's freedom to explore responsibly."
100,problem,"implement a national campaign that promotes digital empathy and respect on social media platforms, encouraging social media companies to prioritize fostering positive online interactions among children while protecting their freedom of expression."
100,problem,"implement a national policy framework that sets clear guidelines and standards for social media platforms to protect children's privacy and personal information online, thereby safeguarding their freedom and ensuring a safe digital environment."
100,problem," establish a collaborative initiative between tech industry professionals, child safety experts, and government agencies to innovate cutting-edge technologies that proactively identify and eliminate online threats to children's safety, preserving their freedom online. "
100,problem,collaborate with social media companies to develop algorithms that proactively identify and remove harmful or predatory content targeting children.
100,problem,implement a nationwide initiative that encourages collaboration between tech industry professionals and child safety experts to develop innovative tools that enhance children's freedom from exposure to online targeted advertising.
100,problem," establish a public-private partnership program where government agencies collaborate with tech companies to create innovative tools that monitor and flag potentially harmful content targeting children on social media, ensuring a balance between freedom of expression and child safety. "
100,problem,"implement a national certification program for social media platforms that meet stringent child safety standards, ensuring the government's commitment to protecting children's freedom online."
100,problem,"establish a government-led initiative to provide comprehensive training programs for teachers and school administrators on monitoring and regulating online targeted advertising to children, empowering them to protect children's freedom while ensuring compliance with safety measures."
100,problem," establish a public-private partnership initiative that funds the development of ai-powered tools to detect and remove harmful content targeting children on social media, promoting a safer online environment and preserving children's freedom of expression. "
100,problem," enforce strict penalties on social media companies that violate regulations regarding targeted advertising to children, holding them accountable for safeguarding children's online experience and respecting their freedom."
100,problem," implement a national program that provides interactive workshops and resources in schools to educate children on social media literacy and digital citizenship, enhancing their freedom to navigate the online world safely."
100,problem,"develop a standardized protocol for law enforcement agencies to collaborate with social media platforms in swiftly responding to reports of online exploitation or abuse, enhancing the government's effectiveness in ensuring children's freedom from harm in the digital space."
100,problem,enhance children's digital literacy and promote responsible online behavior through the development of interactive educational programs in partnership with tech industry professionals and child safety experts.
100,problem,"introduce a national policy that promotes transparency and accountability in online advertising by requiring social media platforms to disclose their practices regarding targeted advertisements to children, safeguarding their freedom online."
100,problem,"implement a national rating system for social media platforms based on their commitment to protecting children's online safety and freedom, providing transparency for taxpayers and encouraging platforms to prioritize child safety."
100,problem,implement a national standard for age verification processes on social media platforms to enhance child safety and protect their online experience while promoting their freedom.
100,problem,"establish a national task force to collaborate with social media companies in developing innovative technologies that proactively identify and eliminate online threats targeting children, preserving their online freedom."
100,problem,"introduce legislation that requires social media companies to provide regular updates on their efforts to combat online misinformation and harmful content targeting children, fostering transparency and empowering stakeholders to hold companies accountable for safeguarding children's freedom of information."
100,problem, implement a national framework that sets clear guidelines for social media platforms to protect children's privacy and personal information online while balancing the freedom of expression. 
100,problem," strengthen enforcement mechanisms for privacy protections of children's data on social media platforms, ensuring their freedom from unauthorized data collection and exploitation. "
100,problem,"implement a national framework mandating all social media platforms to adhere to standardized age verification processes, ensuring children's online safety and freedom from exposure to age-inappropriate content."
100,problem,"establish a collaborative initiative between social media companies and child advocacy groups to develop comprehensive guidelines for protecting children's data privacy online, promoting a culture of transparency and accountability while upholding children's freedom."
100,problem, encourage the development of parental control features on social media platforms that empower parents to set limits on their children's screen time and content exposure while respecting children's freedom to explore safely. 
