Statement Limit,Policy Generation Type,Statement
50,stakeholder, establish a national accreditation program for media literacy organizations to ensure they meet standards for promoting proactive content moderation strategies on social media platforms for children. 
50,stakeholder,implement a national program that incentivizes health insurance providers to offer coverage for mental health services related to online safety issues faced by children on social media platforms.
50,stakeholder,introduce a national initiative to fund research projects focused on understanding the psychological effects of social media on children and developing evidence-based interventions that prioritize proactive content moderation for enhanced safety.
50,stakeholder,implement a national awareness campaign to educate parents and caregivers about the risks of social media for children and the importance of proactive monitoring.
50,stakeholder," collaborate with educational institutions to integrate digital literacy and online safety education into school curriculums, empowering teachers to educate students on responsible social media usage and proactive content moderation strategies. "
50,stakeholder,"establish a program that encourages parents to participate in interactive online safety workshops and simulations, incorporating gamified elements to enhance understanding and retention of key safety practices."
50,stakeholder,"establish a collaborative task force comprising privacy experts, child psychologists, and industry stakeholders to develop and implement advanced ai algorithms for real-time detection and removal of harmful content targeted at children on social media platforms."
50,stakeholder,implement a national program that requires social media platforms catering to children to undergo regular independent audits to assess their compliance with proactive content moderation strategies.
50,stakeholder, implement age-appropriate privacy settings and controls on social media platforms to safeguard children from inappropriate content and online predators. 
50,stakeholder,"establish a national certification program for parenting courses focused on digital literacy and online safety, empowering parents with the knowledge and skills to navigate and regulate their children's social media usage."
50,stakeholder, implement a national program offering tax incentives to social media platforms that demonstrate effective proactive content moderation strategies to protect children online. 
50,stakeholder,"implement a national mentorship program connecting child psychologists and mental health professionals with children at risk of online harm, providing personalized support and guidance for navigating social media challenges."
50,stakeholder, implement a national program incentivizing social media platforms to invest in ai-driven tools for real-time analysis and moderation of child-related content. 
50,stakeholder,implement a national program that mandates social media platforms catering to children to have dedicated support teams for real-time monitoring and removal of harmful content to proactively ensure children's online safety.
50,stakeholder, introduce a national program that fosters collaboration between social media platforms and online safety advocacy groups to co-create innovative tools and resources enhancing proactive content moderation strategies for children's safety online. 
50,stakeholder," establish a task force of experts in child psychology, education, and technology to develop innovative gamified tools for children's safety on social media platforms, with government support and oversight. "
50,stakeholder,implement a national program that promotes collaborations between social media platforms and child safety advocates to develop innovative tools for enhancing children's online safety through proactive content moderation strategies.
50,stakeholder,"implement mandatory periodic privacy audits for social media platforms catering to children, overseen by independent privacy experts, to ensure compliance with stringent data protection regulations and proactive content moderation strategies."
50,stakeholder," establish a national platform for media literacy organizations to share best practices, resources, and research findings on proactive content moderation strategies for children's safety in the digital space. "
50,stakeholder,"introduce a certification program for technology industry leaders focused on social media and children safety, equipping them with specialized knowledge to drive the development and implementation of effective proactive content moderation measures."
50,stakeholder,implement a national initiative that utilizes gamification techniques to engage parents in learning about online safety measures for children on social media platforms.
50,stakeholder,"introduce legislation that mandates social media platforms catering to children to implement real-time reporting mechanisms for users to flag inappropriate content, enabling swift action by platform moderators."
50,stakeholder,"encourage the creation of parent support groups within social media platforms, where parents can share experiences, advice, and strategies for promoting safe and healthy online behaviors for their children."
50,stakeholder, establish a national task force to continuously review and update best practices for proactive content moderation strategies on social media platforms catering to children. 
50,stakeholder," establish a national standard for parental guidance on children's social media usage, emphasizing the importance of monitoring and discussing online activities with their children. "
50,stakeholder, conduct regular evaluations and assessments of the effectiveness of media literacy programs in promoting proactive content moderation strategies and empowering children to navigate social media safely. 
50,stakeholder, establish a national network of professional development programs for teachers to enhance their understanding of online safety issues and equip them with tools to effectively address and prevent harmful content on social media platforms in educational settings. 
50,stakeholder,implement a national program that encourages technology industry leaders to collaborate with child safety experts and researchers to develop cutting-edge tools and algorithms for proactive content moderation on social media platforms catering to children.
50,stakeholder,"establish a regulatory framework that requires social media platforms to conduct regular risk assessments and audits on their content moderation practices for children, with non-compliance leading to penalties to enforce proactive safety measures."
50,stakeholder, establish a regulatory framework mandating social media platforms catering to children to engage in continuous dialogue with online safety advocacy groups to ensure the implementation of effective and up-to-date proactive content moderation measures. 
50,stakeholder, implement a national program that integrates gamification elements into government-led initiatives aimed at enhancing children's online safety awareness and promoting responsible social media behavior. 
50,stakeholder,Do nothing.
50,stakeholder, implement a grant program to support media literacy organizations in developing innovative tools and resources that enhance children's understanding of online safety and responsible social media usage. 
50,stakeholder,"establish a dedicated government-funded research initiative to study the evolving landscape of social media platforms and their impact on children's safety, aiming to inform evidence-based policy development."
50,stakeholder,introduce legislation that mandates regular audits by legal experts on social media platforms catering to children to ensure compliance with legal requirements for content moderation and protection of children's online safety.
50,stakeholder,"implement a rating system for social media platforms that assesses the safety and child-friendliness of content, providing parents with clear guidance on what their children are exposed to online."
50,stakeholder,"implement a national certification program for legal experts focused on social media and children safety, equipping them with the expertise to advise on proactive content moderation strategies within the legal framework."
50,stakeholder," establish a public-private partnership fund, supported by taxpayer contributions, to invest in the development of innovative technologies for child safety on social media platforms. "
50,stakeholder," implement a national initiative that incentivizes social media platforms to actively involve online safety advocacy groups in the development and assessment of their proactive content moderation policies, fostering transparency and accountability. "
50,stakeholder," introduce a national program that gamifies online safety education for children, incorporating interactive challenges and rewards to enhance their understanding of responsible social media usage. "
50,stakeholder,"establish a task force consisting of child safety experts, digital ethicists, and government officials to draft guidelines and regulations that enforce proactive content moderation practices across all social media platforms catering to children."
50,stakeholder," implement a national program that promotes positive online behavior through gamified platforms, encouraging children to actively participate in creating a safe and respectful social media environment. "
50,stakeholder," introduce legislation that mandates social media platforms catering to children to provide regular updates on their content moderation efforts, ensuring transparency and accountability in protecting children from harmful online experiences. "
50,stakeholder, collaborate with child psychologists and tech experts to develop advanced algorithms that prioritize the removal of harmful content and protect children online. 
50,stakeholder," foster collaboration between social media companies, child psychologists, and educators to develop tools that promote positive online behaviors and mental well-being among children. "
50,stakeholder,establish a partnership between health insurance providers and social media platforms to develop protocols for identifying and supporting children at risk of mental health challenges due to online interactions.
50,stakeholder, establish a collaborative platform that utilizes gamification to engage privacy experts in developing innovative strategies for proactive content moderation on social media platforms catering to children. 
50,stakeholder,"establish a research consortium involving child psychologists and mental health professionals to study the psychological impacts of social media on children, with the aim of developing tailored intervention strategies."
50,stakeholder, encourage the development of innovative technologies that empower children to manage their online presence and protect their privacy on social media platforms. 
50,stakeholder, encourage the development of innovative ai technologies that proactively detect and prevent harmful content targeting children on social media platforms. 
50,problem,implement a national policy mandating standardized age verification protocols on all social media platforms to enhance child safety measures and empower parents and guardians in monitoring their children's online interactions effectively.
50,problem,"partner with academic institutions to conduct research on the impact of social media on children's safety and well-being, informing evidence-based policy decisions that empower parents and guardians in protecting their children online."
50,problem," establish a rating system for social media platforms that assesses the level of child safety measures implemented, empowering parents and guardians to make informed decisions about their children's online activities, with input from child advocacy groups and nonprofit organizations. "
50,problem, develop a public awareness campaign in collaboration with child advocacy groups and nonprofit organizations to educate parents and guardians about the risks of algorithmic bias on social media platforms and provide them with tools to advocate for safer online environments for children. 
50,problem,"implement a national program that incentivizes social media platforms to develop innovative features promoting offline activities for children, reducing the negative effects of excessive screen time on their physical and mental health, with oversight from the government."
50,problem, enhance online safety education programs for children by collaborating with social media platforms to develop interactive and age-appropriate resources. 
50,problem," implement a national awareness campaign targeting parents and guardians to educate them about the importance of actively engaging with their children on social media platforms, promoting open communication and fostering a safe online environment, in collaboration with child advocacy groups and nonprofit organizations. "
50,problem,"develop a reward system for social media platforms that demonstrate effective measures in combating cyberbullying and online harassment targeting children, incentivizing proactive steps to create safer online environments, with validation from child advocacy groups and nonprofit organizations."
50,problem,"establish a government-funded initiative to create a national digital literacy curriculum for schools, equipping students with the knowledge and skills to navigate social media safely, with a focus on involving parents in the educational process."
50,problem, encourage the development of innovative technologies that automatically detect and block harmful content targeting children on social media platforms. 
50,problem,"implement a national policy mandating social media platforms to undergo regular independent audits of their age verification measures, ensuring effective safeguards for children and empowering parents and guardians with transparent information."
50,problem,"implement a national program that requires social media platforms to enhance parental control features, providing parents and guardians with effective tools to monitor and manage their children's online activities, in collaboration with government regulators and policymakers."
50,problem, foster partnerships between schools and social media companies to promote digital literacy and responsible online behavior among students. 
50,problem," implement a national campaign to promote the creation of safe online communities for children, engaging parents, guardians, child advocacy groups, and nonprofit organizations in collaborative efforts."
50,problem,"implement a national program that establishes a dedicated task force consisting of government regulators, policymakers, and child safety experts to continuously assess and address the evolving challenges of cyberbullying and online harassment targeting children on social media platforms, empowering parents and guardians."
50,problem,"implement a national program that enforces strict age verification protocols on social media platforms, empowering parents and guardians to control their children's access to age-inappropriate content effectively."
50,problem," develop a comprehensive guide for parents and guardians on setting screen time limits and creating tech-free zones at home to encourage healthy digital habits and family interactions, with input and support from child advocacy groups and nonprofit organizations. "
50,problem,"collaborate with child psychologists and digital media experts to develop a comprehensive online safety training program for parents and guardians, equipping them with the knowledge and skills to recognize and address harmful online challenges effectively."
50,problem,"establish a government-backed initiative to fund research and development of ai tools that analyze and assess the diversity and age-appropriateness of content recommended to children on social media platforms, empowering parents and guardians with effective monitoring capabilities."
50,problem," collaborate with child advocacy groups and nonprofit organizations to develop and implement standardized reporting mechanisms on social media platforms for parents and guardians to easily flag and report instances of online grooming, ensuring swift intervention and protection of children. "
50,problem,"implement a national program that mandates social media platforms to diversify and broaden the content recommended to children, reducing algorithmic bias and promoting a more inclusive online experience for young users, with oversight from government regulators and policymakers."
50,problem,"implement a national initiative to create interactive workshops for parents and guardians, led by child advocacy groups and nonprofit organizations, focusing on effective strategies for monitoring and managing children's online activities, enhancing parental empowerment."
50,problem,"establish a national helpline for parents and guardians to report instances of cyberbullying targeting children on social media, providing them with immediate support and guidance on how to address such incidents effectively, in collaboration with child advocacy groups and nonprofit organizations."
50,problem, establish a national task force dedicated to continuously researching and addressing emerging risks and challenges related to children's safety on social media. 
50,problem,Do nothing.
50,problem,"implement a national program that mandates social media platforms to provide regular updates to parents and guardians on the safety features and privacy settings available for children's accounts, enhancing parental empowerment in safeguarding their children online."
50,problem,"implement a national program that mandates social media platforms to regularly provide detailed reports to parents and guardians on the data privacy and security measures in place for children's accounts, empowering parents to make informed decisions about their children's online activities."
50,problem," implement a national program that promotes outdoor and offline activities for children, reducing their reliance on excessive screen time and enhancing their physical and mental well-being, in collaboration with child advocacy groups and nonprofit organizations. "
50,problem,"collaborate with technology companies to design a user-friendly online platform where parents can access resources, guides, and expert advice on promoting online safety for children, supported by government oversight to ensure credibility."
50,problem,"establish a collaborative initiative between social media platforms, child advocacy groups, and government regulators to develop and enforce strict guidelines that ensure equitable representation and fair treatment of diverse voices in content recommended to children online."
50,problem,"implement a national policy requiring social media platforms to disclose how algorithms recommend content to children, promoting transparency and reducing algorithmic bias, ultimately empowering parents and guardians."
50,problem," implement a national program that provides parents and guardians with resources and training on recognizing and managing internet addiction risks in children, in collaboration with child advocacy groups and nonprofit organizations. "
50,problem,"implement mandatory training programs for social media platform moderators to recognize and promptly respond to cyberbullying and online harassment targeting children, with input and oversight from child advocacy groups and nonprofit organizations."
50,problem,"create a national standard for social media platforms to disclose their content recommendation algorithms to parents and guardians, ensuring visibility into the factors influencing what children see online and promoting accountability in promoting diverse and safe content."
50,problem," implement a national program that establishes a dedicated task force consisting of government regulators, policymakers, and child safety experts to continuously assess and address the evolving challenges of cyberbullying and online harassment targeting children on social media platforms. "
50,problem,establish a government-led initiative to develop educational workshops for parents and guardians on recognizing and addressing addictive features and content on social media that may lead to internet addiction in children.
50,problem," establish a national platform for parents and guardians to access up-to-date information on the latest trends in children's social media usage, data privacy concerns, and recommended safety practices, supported by child advocacy groups and nonprofit organizations. "
50,problem," establish a grant program to fund innovative projects that focus on enhancing digital literacy and online safety for children, with a specific emphasis on empowering parents and guardians through education and resources."
50,problem," implement a national program that encourages social media platforms to develop interactive and engaging educational content aimed at teaching children about online safety and responsible digital citizenship, empowering parents and guardians to guide their children's online behavior effectively. "
50,problem,"implement a national program that establishes a collaborative platform for parents, guardians, and government regulators to share best practices and insights on combating online grooming of children, fostering a unified approach towards child safety on social media platforms."
50,problem," empower parents and guardians by providing them with comprehensive online safety toolkits that include guides on managing privacy settings, recognizing potential risks, and responding to cyberbullying incidents effectively, developed in collaboration with child advocacy groups and nonprofit organizations. "
50,problem,"implement a national program that requires social media platforms to provide regular reports to parents and guardians on the content their children are exposed to, enabling informed decision-making and increased transparency in combating algorithmic bias."
50,problem,"implement a national program that mandates social media platforms to incorporate features promoting healthy screen time habits and blocking addictive content for children, empowering parents and guardians to manage their children's online activities effectively."
50,problem, promote transparency and accountability in social media algorithms to ensure diverse and unbiased content recommendations for children by collaborating with child advocacy groups and nonprofit organizations. 
50,problem," create a national certification program for online safety education providers, endorsed by child advocacy groups and nonprofit organizations, to ensure the quality and effectiveness of educational resources aimed at empowering parents and guardians to protect children from algorithmic bias and harmful content on social media. "
50,problem," implement mandatory training sessions for parents and guardians, facilitated by child advocacy groups and nonprofit organizations, to educate them on recognizing signs of online grooming and equipping them with strategies to safeguard their children effectively. "
50,problem, implement regulations that require social media platforms to incorporate parental control features to empower parents in monitoring and managing their children's online activities. 
50,problem,"establish a government-led initiative to develop educational workshops for parents and guardians on recognizing and addressing addictive features and content on social media that may lead to internet addiction in children, benefiting tax payers."
50,problem," establish a national certification program for social media platforms that meet stringent child safety standards, endorsed by child advocacy groups and nonprofit organizations, enhancing parents' confidence in choosing safe online environments for their children. "
50,problem,"implement a national program that integrates age verification measures on social media platforms, empowering parents and guardians to control and monitor their children's online interactions effectively, in collaboration with child advocacy groups and nonprofit organizations."
50,problem," create a national initiative to establish community-led workshops and support groups for parents and guardians to share strategies and best practices in managing children's screen time effectively, facilitated by child advocacy groups and nonprofit organizations. "
100,base,Do nothing.
100,base, enhance online privacy protections for children on social media platforms 
100,base, establish a national task force to monitor and address cyberbullying incidents involving children on social media 
100,base, develop and implement comprehensive digital literacy programs for children to promote safe and responsible online behavior 
100,base, collaborate with social media companies to create age-appropriate content filters and parental control features 
100,base, increase educational initiatives to raise awareness about the potential risks of social media use among children 
100,chaining,implement mandatory online safety education in schools to equip children with the knowledge and skills to navigate social media responsibly.
100,chaining,establish a national helpline or support service specifically for children facing online threats or harassment on social media platforms.
100,chaining,Do nothing.
100,chaining,enforce stringent penalties on social media platforms that fail to protect children from harmful content or predatory behavior.
100,chaining, collaborate with educational institutions to develop and integrate digital literacy curriculum that educates children on safe and responsible social media usage. 
